{
  "runVersion": "0.1.0",
  "runId": "20260524T055013Z-9936",
  "target": {
    "url": "https://barrierlens.vercel.app/",
    "label": "无碍 BarrierLens · 公众无障碍反馈生成"
  },
  "workflow": {
    "id": "audit-default-v1",
    "label": "Standard website delivery audit"
  },
  "progress": {
    "current": 9,
    "total": 9,
    "label": "9/9 — Report synthesis complete"
  },
  "currentStageId": "synthesis",
  "currentStepId": "issue-cards",
  "activeAnnotation": "验收完成：公开站为演示 Mock 模式；缺隐私政策；上传→生成流程需浏览器复测",
  "status": "completed",
  "stages": [
    {
      "id": "intake",
      "label": "Intake & permissions",
      "order": 1,
      "status": "completed",
      "skill": "audit",
      "steps": [
        { "id": "target", "label": "Confirm target URL", "status": "completed", "evidenceLevel": "LIVE" },
        { "id": "permission", "label": "Set permission boundary", "status": "completed", "evidenceLevel": "SOURCE" }
      ]
    },
    {
      "id": "surface-discovery",
      "label": "Web surface map",
      "order": 2,
      "status": "completed",
      "skill": "audit",
      "steps": [
        { "id": "routes", "label": "List routes & CTAs", "status": "completed", "evidenceLevel": "LIVE" }
      ]
    },
    {
      "id": "source-pass",
      "label": "Source evidence",
      "order": 3,
      "status": "completed",
      "skill": "audit",
      "steps": [
        { "id": "claims", "label": "Collect claims", "status": "completed", "evidenceLevel": "LIVE" }
      ]
    },
    {
      "id": "feature-inventory",
      "label": "Feature inventory",
      "order": 4,
      "status": "completed",
      "skill": "audit",
      "steps": [
        { "id": "inventory", "label": "Build feature table", "status": "completed", "evidenceLevel": "LIVE" }
      ]
    },
    {
      "id": "live-functional",
      "label": "Live functional test",
      "order": 5,
      "status": "completed",
      "skill": "flow-test",
      "steps": [
        { "id": "homepage-load", "label": "Homepage load", "status": "completed", "evidenceLevel": "LIVE" },
        { "id": "cta-primary", "label": "生成反馈报告", "status": "issue_found", "evidenceLevel": "UNKNOWN", "annotation": "Mock mode on deploy; click flow not run" },
        { "id": "lead-form", "label": "Photo upload", "status": "skipped_safe", "evidenceLevel": "UNKNOWN" }
      ]
    },
    {
      "id": "visual-qa",
      "label": "Visual QA",
      "order": 6,
      "status": "completed",
      "skill": "visual-qa",
      "steps": [
        { "id": "viewport-desktop", "label": "Desktop viewport", "status": "completed", "evidenceLevel": "INFERRED" }
      ]
    },
    {
      "id": "deploy-check",
      "label": "Deployment readiness",
      "order": 7,
      "status": "completed",
      "skill": "deploy-check",
      "steps": [
        { "id": "env-deps", "label": "GEMMA_API_KEY / Vercel", "status": "issue_found", "evidenceLevel": "LIVE" }
      ]
    },
    {
      "id": "synthesis",
      "label": "Report synthesis",
      "order": 8,
      "status": "completed",
      "skill": "audit",
      "steps": [
        { "id": "issue-cards", "label": "Issue cards", "status": "completed", "evidenceLevel": "SOURCE" }
      ]
    },
    {
      "id": "accept-five",
      "label": "Five-pass (optional)",
      "order": 9,
      "status": "skipped",
      "skill": "accept-five",
      "steps": [
        { "id": "pass-1", "label": "Baseline pass", "status": "skipped_safe" }
      ]
    }
  ],
  "findingsPreview": [
    {
      "title": "Production deploy runs Mock without GEMMA_API_KEY",
      "severity": "S1",
      "stageId": "deploy-check",
      "evidenceLevel": "LIVE"
    },
    {
      "title": "No privacy policy for photo uploads",
      "severity": "S1",
      "stageId": "synthesis",
      "evidenceLevel": "LIVE"
    },
    {
      "title": "Upload → generate workflow not browser-proven",
      "severity": "S2",
      "stageId": "live-functional",
      "evidenceLevel": "UNKNOWN"
    }
  ],
  "eventsPath": "validation/golden/barrierlens-run-events.example.ndjson",
  "reportPath": "reports/barrierlens-audit.html",
  "updatedAt": "2026-05-24T05:53:00Z"
}
